{
  "executable_sources": [
    {
      "blob_oid": "ee4891539251ab4df08049af2c9cb9d694caf018",
      "content_sha256": "98eb46481247490dfa133f08cf9f0f7c3497e97f36382c4f65fb0470d8dca527",
      "mode": "100644",
      "path": "eslint.config.mjs"
    },
    {
      "blob_oid": "aaf882fd6416ced29a6c7ba4a102029988a7f89d",
      "content_sha256": "2a2240c0841f369b4c79547529b7fac16636902820c5462c48080014f0391b4c",
      "mode": "100644",
      "path": "tools/audit-pinned-extraction.mjs"
    },
    {
      "blob_oid": "872972b24b1c0de39809c41183dec2f2e112a35c",
      "content_sha256": "c01f822ea6c91be2a87d99a4e29066aae2076bd7e50437f4c008713540c4d8b2",
      "mode": "100644",
      "path": "tools/build-package.mjs"
    },
    {
      "blob_oid": "ddcae431da8b6e646395c712d2d8ec0a113f5ea7",
      "content_sha256": "ec128d6d540d16b7e5f07d97936f04e68371eb2b4ddad18cb39cb213440fb3e9",
      "mode": "100644",
      "path": "tools/build-source-artifact.mjs"
    },
    {
      "blob_oid": "92a0b5bb993d58cb07982a1d7ac333018e456542",
      "content_sha256": "2f632e49f40bc7e70aea0b4ca64dece68a21f3e6b2bb6a6a06aa04f4c0e2e700",
      "mode": "100644",
      "path": "tools/canonical-json.mjs"
    },
    {
      "blob_oid": "80a1897f6b20591a5b1d4f2b7366451ad4c8f51f",
      "content_sha256": "e20e48806507d4658e52acc143e8adef1abb2c849dddf37e045af7ac0379cbb5",
      "mode": "100644",
      "path": "tools/check-parity.mjs"
    },
    {
      "blob_oid": "689aa0e7a5bd6ed5f21dd40c39f3e15c6c77c1af",
      "content_sha256": "bf6180a28a08704505e477d3e40ae02ea6718480f917fc3ee1e9d49719ef84d2",
      "mode": "100644",
      "path": "tools/check-repository-authority.mjs"
    },
    {
      "blob_oid": "fbd2f3142ad29e6926648b25a6dc6c2352f13e77",
      "content_sha256": "90b09162018f7948098c8abf4ce323802022731d6c41cd1d395f71746a2358b5",
      "mode": "100644",
      "path": "tools/check-runtime-inventory.mjs"
    },
    {
      "blob_oid": "e2c50cd6d2b92e2ca049453c3c3a91166cbc38ed",
      "content_sha256": "0a38a1116d27f61a2a1a78d12a81d182b5d5aae7e35c3e974afb79cc77e71da2",
      "mode": "100644",
      "path": "tools/dogfooding/journal-client.mjs"
    },
    {
      "blob_oid": "a4b68161d5a447b52c3e66cff4b325ed1bc459d2",
      "content_sha256": "6b33c7f77f2dc36ccd60bd0c725307c37ddd67629b39b9ccc6b5624846abd41e",
      "mode": "100644",
      "path": "tools/emit-source-inventory.mjs"
    },
    {
      "blob_oid": "bda929d0e3a41656c286dd38521f387fc9806fb1",
      "content_sha256": "431fbcb6922466839abe0436594b98ce67e58030149944df0a9383c9ee57fcd4",
      "mode": "100755",
      "path": "tools/fresh-clone-acceptance.sh"
    },
    {
      "blob_oid": "d72ec7271f594413b5f538b85b7279504e883e5a",
      "content_sha256": "4dfdcd522e40dbe823404bc34a923e2bdaf7656e23ea487495deea8a0df5f0fd",
      "mode": "100644",
      "path": "tools/fresh-clone-cleanup.mjs"
    },
    {
      "blob_oid": "2bc84e2af50da93f81a79eb95731dad6e49f179b",
      "content_sha256": "146ec6213fc51e744eb262d2b03490a8056826c59d25e8179f08cce70a3255f0",
      "mode": "100644",
      "path": "tools/fresh-clone-verifier.mjs"
    },
    {
      "blob_oid": "cd1b2d6a1617a3f297d41d6a881f8796c688beef",
      "content_sha256": "8567322a652abf88255ac5f290311183cab4700295148f23203ca1f89324ff33",
      "mode": "100644",
      "path": "tools/generate-extraction-baseline.mjs"
    },
    {
      "blob_oid": "afc002a8cc11557dc1b74a8b7d488987a4a09c5d",
      "content_sha256": "8f4f53381689e1eabb334643e20ec7785245587fc00b8f73a65b3108ba4804e7",
      "mode": "100755",
      "path": "tools/install-gitleaks.sh"
    },
    {
      "blob_oid": "41cf4af800376da56345a9b9afbae1faeb08dc9d",
      "content_sha256": "3743bc1e5525e58e72369cd85aab45694ab3029cad1e16ef625732b4d259dc57",
      "mode": "100644",
      "path": "tools/package-smoke-fixture.mjs"
    },
    {
      "blob_oid": "1fcc483b4aede885c88fcaef692e840877295783",
      "content_sha256": "311f9a7955ff690f6d3095f4639ddb08ca52f0045341b68c940207f25c7547f2",
      "mode": "100755",
      "path": "tools/prefetch-secret-scan-refs.mjs"
    },
    {
      "blob_oid": "1c2cfed0f59a1ae9d99ea6f5e474a779439dfafd",
      "content_sha256": "df6039237b098a3a2c39bc4ad015ac85230ec1dd0365a249eb61cc29c075d282",
      "mode": "100644",
      "path": "tools/repository-bootstrap-gate.mjs"
    },
    {
      "blob_oid": "458a1afeb3ee92e1803e2cec5ca3aab1d4030dfd",
      "content_sha256": "4492c46e57079c675b941d7fe5f420726d0482248c407e6bc887279b6e1ffc76",
      "mode": "100644",
      "path": "tools/secret-scan.mjs"
    },
    {
      "blob_oid": "e82a426f30c3b0b8087c50e9ebc840530acf29ad",
      "content_sha256": "03a178295eef525ed7fb7f5b884cb61f114c1819a2c78ed1cbf3a205e12a71f7",
      "mode": "100755",
      "path": "tools/secret-scan.sh"
    },
    {
      "blob_oid": "4b74a61d137cd7fe2c01875348b8a62a13894c1f",
      "content_sha256": "627b2d117bb0d5ae9d550f345881b85d3f1a2dd741e21eb35fb1f45ac54b0305",
      "mode": "100644",
      "path": "tools/smoke-package.mjs"
    },
    {
      "blob_oid": "7fe201c2c183cb8a67455b121cf1447a79f34863",
      "content_sha256": "b3c22f0022a6c5ee02da934ccf31d1b038075337d94a3095953e81d5bffea6f8",
      "mode": "100644",
      "path": "tools/sync-agent-instructions.mjs"
    },
    {
      "blob_oid": "fc02e1441158fd9fbb64f4ca04eca160f0a25fe8",
      "content_sha256": "6d49e01418832f99a7526a2f1f2442c462513caf1a51f89a79c0303b9a944e42",
      "mode": "100644",
      "path": "tools/verify-context-tools.mjs"
    },
    {
      "blob_oid": "65693f7c6d098ec68ebf10c6098ec83b23182f04",
      "content_sha256": "6184b1cb9a7b378c477a6854e76f5a383ef3d820e625c8e157c6ec56e9663525",
      "mode": "100644",
      "path": "tools/verify-service-parity.mjs"
    },
    {
      "blob_oid": "c1f5db4791be0db809e855a60ece1206b7dc209b",
      "content_sha256": "3fb8a7f6bf8fcec67cfdf7ceb29635bdc255e27b9f1faf1a85843a0cb1329508",
      "mode": "100644",
      "path": "tools/verify-source-artifact.mjs"
    },
    {
      "blob_oid": "4fcd498870ae7d9d2ad81164c7db6263e90c03da",
      "content_sha256": "c5a02004aaa0017094e29e535c81d0c2361dd92524a643473413f9a5ca9f3b35",
      "mode": "100644",
      "path": "tsconfig.json"
    },
    {
      "blob_oid": "5a417cff8d9108c5e0f55ad69e217ffbef5b739d",
      "content_sha256": "318748f0130c61e940c6f0743eba289cca502a3fd09f7464f1a392badef4e879",
      "mode": "100644",
      "path": "vitest.ci.config.ts"
    },
    {
      "blob_oid": "3817d8cc88ebe7c57c34f495cff1e1fbb5989786",
      "content_sha256": "37763bfcf4a8e8b2dccc661bea102ee9e34f30636468671bd19ac64bb26a3b6d",
      "mode": "100644",
      "path": "vitest.operator.config.ts"
    }
  ],
  "lock_sha256": "b95061f7a7ee5a2b4dbc0945207d3025c188709bd0fa4c2f982c04a7cb29ca2f",
  "npm_closure": [
    {
      "cpu": [
        "ppc64"
      ],
      "dependencies": [],
      "integrity": "sha512-Svl7tq8k/08+p6CXPpRjQ1fKX+1odH/BQbb48fV6fj3CWHhsoIOoY87w1oHXm0qEpkIK3ZfVgp0hed3XBXzXMQ==",
      "lock_path": "node_modules/@esbuild/aix-ppc64",
      "optional": true,
      "os": [
        "aix"
      ],
      "version": "0.28.1"
    },
    {
      "cpu": [
        "arm"
      ],
      "dependencies": [],
      "integrity": "sha512-0k2F129Xdio1TdJfzJ8sy1Q47vUD2NnwdhiAf7drUN1EBTfPf4hsFCtmMgu/6m8JSzsBrlmVjudMBQqOfG8usQ==",
      "lock_path": "node_modules/@esbuild/android-arm",
      "optional": true,
      "os": [
        "android"
      ],
      "version": "0.28.1"
    },
    {
      "cpu": [
        "arm64"
      ],
      "dependencies": [],
      "integrity": "sha512-34EGEbCIAgosYz6goLcopX6Mo7NyGv9tfwEM2/7Ce2VcVRk568iSvniGWcUXIy7wEDR1wzolcxcriFVrWYcwBg==",
      "lock_path": "node_modules/@esbuild/android-arm64",
      "optional": true,
      "os": [
        "android"
      ],
      "version": "0.28.1"
    },
    {
      "cpu": [
        "x64"
      ],
      "dependencies": [],
      "integrity": "sha512-dbwY7ltSMDWsRatcRpCnES4F+im88OCUgGZjy52shC7GqHRE/cYlxNbB4Z4UpJswpcc4Qxd2oE/ufM0p61IKng==",
      "lock_path": "node_modules/@esbuild/android-x64",
      "optional": true,
      "os": [
        "android"
      ],
      "version": "0.28.1"
    },
    {
      "cpu": [
        "arm64"
      ],
      "dependencies": [],
      "integrity": "sha512-TZbWkQY7kvTAXbXUT7uVACR5cMHsDiSz9z7ZKAX/RTq/WJEk3QyRr0wZpNhBDX+/0CtdqUIJlOiodQcta6tY3Q==",
      "lock_path": "node_modules/@esbuild/darwin-arm64",
      "optional": true,
      "os": [
        "darwin"
      ],
      "version": "0.28.1"
    },
    {
      "cpu": [
        "x64"
      ],
      "dependencies": [],
      "integrity": "sha512-zfdzgK9ACBNZLI/CyHTOx81SyNbM6YXn7rxSgX97VjyiPl9W1i4Ka4fgKECEoFCKGpvBj5qArWIGgQjOwkgskQ==",
      "lock_path": "node_modules/@esbuild/darwin-x64",
      "optional": true,
      "os": [
        "darwin"
      ],
      "version": "0.28.1"
    },
    {
      "cpu": [
        "arm64"
      ],
      "dependencies": [],
      "integrity": "sha512-wG2EA8ENdEI0qhkSZMjfqrdY+ziCYCPMmtZjjIwOmXFjmyzEHn+UUxk5of+SYsjtfs3VpnlC7QLzSI5hY/rOAw==",
      "lock_path": "node_modules/@esbuild/freebsd-arm64",
      "optional": true,
      "os": [
        "freebsd"
      ],
      "version": "0.28.1"
    },
    {
      "cpu": [
        "x64"
      ],
      "dependencies": [],
      "integrity": "sha512-i7dZ9vQgnvSCzi/rYCXNgtF/U+eKZNJBzu3eTQbRgHnM7tNSizLOkRFAl3qzVc/Op/u5YkHHa4pf/3DOYHthLQ==",
      "lock_path": "node_modules/@esbuild/freebsd-x64",
      "optional": true,
      "os": [
        "freebsd"
      ],
      "version": "0.28.1"
    },
    {
      "cpu": [
        "arm"
      ],
      "dependencies": [],
      "integrity": "sha512-qVXBOHQS+d5Y722GwJzJUtOLlX7km3CraOaGormF1pDtPd2C/l1SHRPgjLunLGe51Sh5YYWKMFDyV4SxgMQYTQ==",
      "lock_path": "node_modules/@esbuild/linux-arm",
      "optional": true,
      "os": [
        "linux"
      ],
      "version": "0.28.1"
    },
    {
      "cpu": [
        "arm64"
      ],
      "dependencies": [],